<?xml version="1.0" encoding="UTF-8"?>
<xs:schema xmlns:xs="http://www.w3.org/2001/XMLSchema">

    <!-- Define the structure of the recipes element -->
    <xs:element name="recipes">
        <xs:complexType>
            <xs:sequence>
                <xs:element name="recipe" maxOccurs="unbounded">
                    <xs:complexType>
                        <xs:sequence>
                            <xs:element name="title" type="xs:string"/>
                            <xs:element name="description" type="xs:string"/>
                            <xs:element name="ingredients">
                                <xs:complexType>
                                    <xs:sequence>
                                        <xs:element name="ingredient" type="xs:string" maxOccurs="unbounded"/>
                                    </xs:sequence>
                                </xs:complexType>
                            </xs:element>
                            <xs:element name="instructions">
                                <xs:complexType>
                                    <xs:sequence>
                                        <xs:element name="step" type="xs:string" maxOccurs="unbounded"/>
                                    </xs:sequence>
                                </xs:complexType>
                            </xs:element>
                        </xs:sequence>
                    </xs:complexType>
                </xs:element>
            </xs:sequence>
        </xs:complexType>
    </xs:element>

</xs:schema>